{
  "id": "SCR-WEB-DEVELOPMENT",
  "name": "Web Development",
  "purpose": "Explain the full-stack web development offer for fast, accessible and maintainable websites and applications.",
  "status": "implemented",
  "components": [
    "CMP-PUBLIC-SHELL",
    "CMP-HEADER",
    "CMP-FOOTER",
    "CMP-RELATED-CONTENT"
  ],
  "states": [
    {
      "name": "Default",
      "type": "default"
    },
    {
      "name": "Render failed",
      "type": "error",
      "trigger": "The page template cannot be rendered."
    }
  ],
  "handler": "(*http.PublicPageHandler).ServeHTTP",
  "route": "/web-development/",
  "template": "web/templates/pages/public/web-development.html",
  "layout": "web/templates/layouts/base.html",
  "flows": [
    "FLOW-PUBLIC-EXPLORATION"
  ],
  "references": [
    {
      "type": "implementation",
      "label": "Public page registry and handler",
      "path": "internal/http/public_pages.go",
      "relationship": "implements"
    }
  ],
  "implementation": {
    "method": "GET",
    "serverRendered": true,
    "javascriptRequired": false,
    "htmx": false
  }
}
